Title, Image, Link, Price, Reviews, Stars
"YGEOMER Floating Shelves, Rustic Wood Shelves, 4 Sets of Wall Mounted Shelf for Bathroom Decor, Bedroom, Living Room and Plants (Carbonized Black)","https://m.media-amazon.com/images/I/61ep3xgFcaL._AC_UL320_.jpg","https://amazon.com/YGEOMER-Floating-Carbonized-Multifunctional-Wall-Mounted/dp/B08NSFV92Z/ref=sr_1_1?crid=36QNR0DBY6M7J&keywords=shelves&qid=1675279590&refresh=1&sprefix=s%2Caps%2C309&sr=8-1","$24.99$34.99","5,289","4.5 out of 5 stars"
"upsimples Floating Shelves for Wall Décor Storage, Wall Mounted Shelves Set of 5, Sturdy Wood Floating Shelves with Metal Brackets for Bedroom, Living Room, Bathroom, Over Toilet, Kitchen, Dark Brown","https://m.media-amazon.com/images/I/71wOLNZUZCL._AC_UL320_.jpg","https://amazon.com/upsimples-Floating-Shelves-Brackets-Bathroom/dp/B09YM5KZ1T/ref=sr_1_2?crid=36QNR0DBY6M7J&keywords=shelves&qid=1675279590&refresh=1&sprefix=s%2Caps%2C309&sr=8-2","$21.99$28.99","306","3.9 out of 5 stars"
"Canupdog Corner Floating Shelves Wall Mounted Set of 4, Wood Display Storage Wall Shelves for Living Room, Bedroom, Office, Bathroom Kitchen & Decoration","https://m.media-amazon.com/images/I/71j1CpyL4jL._AC_UL320_.jpg","https://amazon.com/Canupdog-Floating-Shelves-Bathroom-Decoration/dp/B0B2PKFKKC/ref=sr_1_3?crid=36QNR0DBY6M7J&keywords=shelves&qid=1675279590&refresh=1&sprefix=s%2Caps%2C309&sr=8-3","$37.99$59.99","345","4.3 out of 5 stars"
"AMADA HOMEFURNISHING Floating Shelves Wall Mounted Set of 3, Rustic Wood Wall Shelves for Bedroom, Bathroom, Living Room, Kitchen, Laundry Room Storage & Decoration, Gray","https://m.media-amazon.com/images/I/61bQz-M2u3S._AC_UL320_.jpg","https://amazon.com/Floating-Shelves-Paulownia-Bathroom-Farmhouse/dp/B082CS6JVK/ref=sr_1_4?crid=36QNR0DBY6M7J&keywords=shelves&qid=1675279590&refresh=1&sprefix=s%2Caps%2C309&sr=8-4","$15.98$29.99","20,341","4.4 out of 5 stars"
"Amazon Basics 3-Shelf Adjustable, Heavy Duty Storage Shelving Unit (250 lbs loading capacity per shelf), Steel Organizer Wire Rack, Black (23.2L x 13.4W x 30H)","https://m.media-amazon.com/images/I/71Cb8Xb15FL._AC_UL320_.jpg","https://amazon.com/Amazon-Basics-Adjustable-Shelving-Organizer/dp/B01LWP8AL2/ref=sr_1_5?crid=36QNR0DBY6M7J&keywords=shelves&qid=1675279590&refresh=1&sprefix=s%2Caps%2C309&sr=8-5","$38.46","204,215","4.7 out of 5 stars"
"6-Wire Shelving Metal Storage Rack Shelves, Standing Storage Shelf Units for Laundry Bathroom Kitchen Pantry Closet(Black)","https://m.media-amazon.com/images/I/5168yxslApL._AC_UL320_.jpg","https://amazon.com/Shelving-Storage-Shelves-Standing-Bathroom/dp/B0BFPQQMML/ref=sr_1_6?crid=36QNR0DBY6M7J&keywords=shelves&qid=1675279590&refresh=1&sprefix=s%2Caps%2C309&sr=8-6","$37.99","43","4.5 out of 5 stars"
"Floating Shelves, 17 Inch Wall Shelf Set of 3, Rustic Wood Shelves for Wall Storage, Wall Mounted Wooden Display Shelf for Bathroom Bedroom Kitchen Garage, Carbonized Black","https://m.media-amazon.com/images/I/91JpZa2DYTL._AC_UL320_.jpg","https://amazon.com/Floating-Shelves-Storage-Bathroom-Carbonized/dp/B09Y8SBYZB/ref=sr_1_7?crid=36QNR0DBY6M7J&keywords=shelves&qid=1675279590&refresh=1&sprefix=s%2Caps%2C309&sr=8-7","$36.99$49.99","241","4.2 out of 5 stars"
"RICHER HOUSE 5 Set White Floating Shelves, Wall Mounted Shelves for Wall Decor, Modern Picture Ledge Shelf with Lip for Wall Storage Nursery, Bedroom, Living Room, Bathroom - White","https://m.media-amazon.com/images/I/61KZj7rsdIL._AC_UL320_.jpg","https://amazon.com/RICHER-HOUSE-Floating-Shelves-Bathroom/dp/B0BJZVZZSL/ref=sr_1_8?crid=36QNR0DBY6M7J&keywords=shelves&qid=1675279590&refresh=1&sprefix=s%2Caps%2C309&sr=8-8","$21.99"
"BAYKA Wall Shelves for Bedroom Decor, Floating Wall Shelves for Living Room Kitchen Storage, Wall Mounted Rustic Wood Floating Shelves for Kids Books, Small Shelf for Bathroom(Black，Set of 3)","https://m.media-amazon.com/images/I/71DazwWZuIL._AC_UL320_.jpg","https://amazon.com/BAYKA-Floating-Shelves-Mounted-Bathroom/dp/B08J6NQMQ5/ref=sr_1_9?crid=36QNR0DBY6M7J&keywords=shelves&qid=1675279590&refresh=1&sprefix=s%2Caps%2C309&sr=8-9","$21.99$39.98","6,381","4.6 out of 5 stars"
"Furinno (99557BK/GY) Turn-N-Tube 4-Tier Multipurpose Shelf Display Rack - Black/Grey","https://m.media-amazon.com/images/I/610nyBsduOL._AC_UL320_.jpg","https://amazon.com/Furinno-99557BK-GY-Turn-N-Tube-Multipurpose/dp/B007KLYD46/ref=sr_1_10?crid=36QNR0DBY6M7J&keywords=shelves&qid=1675279590&refresh=1&sprefix=s%2Caps%2C309&sr=8-10","$28.38$59.99","67,599","4.5 out of 5 stars"
"VITEVER Set of 3, Wall Floating Bathroom Shelves with 1 Towel Bar - Wall Mounted Hanging Shelf for Bedroom, Living Room, Kitchen Storage Organizer - Rustic Farmhouse Bathroom Home Decor - Light Brown","https://m.media-amazon.com/images/I/71u5JaHFldL._AC_UL320_.jpg","https://amazon.com/Wall-Floating-Bathroom-Shelves-Towel/dp/B09YNM1TRG/ref=sr_1_11?crid=36QNR0DBY6M7J&keywords=shelves&qid=1675279590&refresh=1&sprefix=s%2Caps%2C309&sr=8-11","$19.99$29.99","222","4.5 out of 5 stars"
"Upsimples Home Floating Shelves for Wall Décor Storage, Wall Shelves Set of 5, Wall Mounted Wood Shelves for Bedroom, Living Room, Bathroom, Kitchen, Small Picture Ledge Farmhouse Shelves, Brown","https://m.media-amazon.com/images/I/817MJ5NLqDL._AC_UL320_.jpg","https://amazon.com/Upsimples-Home-Floating-Shelves-Different/dp/B09CQ6FS1L/ref=sr_1_12?crid=36QNR0DBY6M7J&keywords=shelves&qid=1675279590&refresh=1&sprefix=s%2Caps%2C309&sr=8-12","$19.99$27.99","1,466","4.5 out of 5 stars"
"RICHER HOUSE Floating Wall Shelves, Rustic Wood Bathroom Shelves Set of 5, Farmhouse Style Floating Shelf for Wall Décor, Hanging Shelves for Bedroom, Storage, Kitchen, Living Room - Carbonized Black","https://m.media-amazon.com/images/I/61W4PKrv02L._AC_UL320_.jpg","https://amazon.com/RICHER-HOUSE-Floating-Bathroom-Farmhouse/dp/B0B96K5P3L/ref=sr_1_13?crid=36QNR0DBY6M7J&keywords=shelves&qid=1675279590&refresh=1&sprefix=s%2Caps%2C309&sr=8-13","$32.99","444","4.5 out of 5 stars"
"YYWUOJJ Rustic Wood Floating Shelves for Wall Decor Farmhouse Hanging Wall Shelves for Bathroom Kitchen Living Room Bedroom, Set of 4 Carbonized Black","https://m.media-amazon.com/images/I/71LFdGlINtL._AC_UL320_.jpg","https://amazon.com/YYWUOJJ-Floating-Farmhouse-Bathroom-Carbonized/dp/B0BHZD7FWP/ref=sr_1_14?crid=36QNR0DBY6M7J&keywords=shelves&qid=1675279590&refresh=1&sprefix=s%2Caps%2C309&sr=8-14","$20.99","5","4.2 out of 5 stars"
"SRIWATANA Floating Shelves Wall Mounted, Solid Wood Wall Shelves, White","https://m.media-amazon.com/images/I/61E7HMcVf+L._AC_UL320_.jpg","https://amazon.com/SRIWATANA-Floating-Shelves-Mounted-Washed/dp/B07XC75B69/ref=sr_1_15?crid=36QNR0DBY6M7J&keywords=shelves&qid=1675279590&refresh=1&sprefix=s%2Caps%2C309&sr=8-15","$15.99$21.99","25,974","4.4 out of 5 stars"
"AMADA HOMEFURNISHING Floating Shelves, Wall Shelves for Bathroom/Living Room/Bedroom/Kitchen Decor, White Shelves with Invisible Brackets Set of 3 - AMFS08","https://m.media-amazon.com/images/I/412ZRen3BeL._AC_UL320_.jpg","https://amazon.com/Floating-Shelves-Invisible-Mounted-Bathroom/dp/B088ZYNX1J/ref=sr_1_16?crid=36QNR0DBY6M7J&keywords=shelves&qid=1675279590&refresh=1&sprefix=s%2Caps%2C309&sr=8-16","$33.99$50.99","6,841","4.6 out of 5 stars"
"Furinno Pasir 3-Tier Open Shelf Bookcase, Espresso","https://m.media-amazon.com/images/I/51qNBrE0EpL._AC_UL320_.jpg","https://amazon.com/Furinno-11208EX-Pasir-3-Tier-Espresso/dp/B00PC5DRPS/ref=sr_1_17?crid=36QNR0DBY6M7J&keywords=shelves&qid=1675279590&refresh=1&sprefix=s%2Caps%2C309&sr=8-17","$26.80$74.99","35,476","4.3 out of 5 stars"
"Love-KANKEI Floating Shelves Wall Mounted Set of 2, 17 Inch Rustic Wood Wall Shelves for Storage, Bedroom Living Room Bathroom Kitchen Office and More White","https://m.media-amazon.com/images/I/51ZiOMd-b+S._AC_UL320_.jpg","https://amazon.com/Love-KANKEI-Floating-Shelves-Mounted-Bathroom/dp/B086V91N57/ref=sr_1_18?crid=36QNR0DBY6M7J&keywords=shelves&qid=1675279590&refresh=1&sprefix=s%2Caps%2C309&sr=8-18","$18.99$24.97","6,982","4.2 out of 5 stars"
"WOPITUES Floating Shelves with Black Metal Guardrail, Shelves for Wall Decor Set of 3, Wall Shelves for Bedroom, Bathroom, Kitchen, Living Room, Plants, Picture Frames, Art- Dark Walnut","https://m.media-amazon.com/images/I/71lWrXIZH+L._AC_UL320_.jpg","https://amazon.com/WOPITUES-Floating-Shelves-Guardrail-Bathroom/dp/B0BKY72BGK/ref=sr_1_19?crid=36QNR0DBY6M7J&keywords=shelves&qid=1675279590&refresh=1&sprefix=s%2Caps%2C309&sr=8-19","$29.99","71","4.7 out of 5 stars"
"Shario White Floating Shelves - Set of 2, Wall Mounted Hanging Shelves with Golden Towel Rack, Decorative Storage Shelves for Bathroom, Kitchen, Living Room & Bedroom (White)","https://m.media-amazon.com/images/I/71k+EHRwvRL._AC_UL320_.jpg","https://amazon.com/SHARIO-White-Floating-Shelves-Decorative/dp/B08TN3QSS3/ref=sr_1_20?crid=36QNR0DBY6M7J&keywords=shelves&qid=1675279590&refresh=1&sprefix=s%2Caps%2C309&sr=8-20","$27.95$34.97","1,913","4.6 out of 5 stars"
"Simple Trending 3-Tier Stackable Wire Shelving Unit Storage Rack, Expandable & Adjustable Kitchen Storage Cabinet Shelf Organizer, Black","https://m.media-amazon.com/images/I/819mMUlstjL._AC_UL320_.jpg","https://amazon.com/Simple-Trending-Stackable-Expandable-Adjustable/dp/B09W1VY2KX/ref=sr_1_21?crid=36QNR0DBY6M7J&keywords=shelves&qid=1675279590&refresh=1&sprefix=s%2Caps%2C309&sr=8-21","$38.97","72","4.9 out of 5 stars"
"Boswillon White Floating Shelves for Wall, 4 Sets White Wall Shelves for Bedroom with Invisible Brackets, White Shelves for Wall Decor, Modern White Shelf for Bathroom, Kitchen – White","https://m.media-amazon.com/images/I/719TiLzFPbL._AC_UL320_.jpg","https://amazon.com/Boswillon-Floating-Invisible-Brackets-Bathroom/dp/B0B5T4BSZ8/ref=sr_1_22?crid=36QNR0DBY6M7J&keywords=shelves&qid=1675279590&refresh=1&sprefix=s%2Caps%2C309&sr=8-22","$29.99","275","4.6 out of 5 stars"
"7-Pack Small Floating Shelves for Wall by RicherHouse, Plastic Small Black Shelf 4 Inch Display Ledges for Room Decor, Mini Shelf for Wall with 2 Types of Installation (Adhesive or Screw)","https://m.media-amazon.com/images/I/51PKga12FnL._AC_UL320_.jpg","https://amazon.com/Floating-Shelves-RicherHouse-Installation-Adhesive/dp/B09SZ5YPTS/ref=sr_1_23?crid=36QNR0DBY6M7J&keywords=shelves&qid=1675279590&refresh=1&sprefix=s%2Caps%2C309&sr=8-23","$21.99","3,618","4.3 out of 5 stars"
"Love-KANKEI Floating Shelves Wall Mounted Set of 3, Rustic Wood Wall Storage Shelves for Bedroom, Living Room, Bathroom, Kitchen, Office and More Carbonized Black","https://m.media-amazon.com/images/I/61JSdwodY1L._AC_UL320_.jpg","https://amazon.com/Love-KANKEI-Floating-Shelves-Mounted-Bathroom/dp/B077GQ87NP/ref=sr_1_24?crid=36QNR0DBY6M7J&keywords=shelves&qid=1675279590&refresh=1&sprefix=s%2Caps%2C309&sr=8-24","$19.99$28.99","59,100","4.5 out of 5 stars"
"AMADA HOMEFURNISHING Floating Shelves, Bathroom Shelf with Towel Bar, Wall Shelves for Bathroom/Living Room/Kitchen/Bedroom, Light Brown Shelves Set of 2 - AMFS01","https://m.media-amazon.com/images/I/71QiGx4I28L._AC_UL320_.jpg","https://amazon.com/Floating-Paulownia-Bathroom-Decorative-Removable/dp/B082CMK8TW/ref=sr_1_25?crid=36QNR0DBY6M7J&keywords=shelves&qid=1675279590&refresh=1&sprefix=s%2Caps%2C309&sr=8-25","$17.59$33.99","15,088","4.6 out of 5 stars"
"HOOBRO Floating Shelves, Wall Shelf Set of 2, 15.7 inch Hanging Shelf with Invisible Brackets, for Bathroom, Bedroom, Toilet, Kitchen, Office, Living Room Decor, Rustic Brown BF40BJ01","https://m.media-amazon.com/images/I/81Cb7jKsC5L._AC_UL320_.jpg","https://amazon.com/HOOBRO-Floating-Invisible-Brackets-Bathroom/dp/B07W4G4BNG/ref=sr_1_26?crid=36QNR0DBY6M7J&keywords=shelves&qid=1675279590&refresh=1&sprefix=s%2Caps%2C309&sr=8-26","$29.99$32.99","2,898","4.6 out of 5 stars"
"Cq acrylic 4 Pack Clear Acrylic Floating Wall Ledge Shelf,15" Invisible Wall Mounted Nursery Kids Floating Bookshelf for Kids Room,U Modern Picture Ledge Display Toy Storage Wall Shelf,Clear","https://m.media-amazon.com/images/I/71YXZ19yMFL._AC_UL320_.jpg","https://amazon.com/15-Invisible-Bookshelf-Cq-acrylic/dp/B088BBWJ56/ref=sr_1_27?crid=36QNR0DBY6M7J&keywords=shelves&qid=1675279590&refresh=1&sprefix=s%2Caps%2C309&sr=8-27","$27.99","3,288","4.4 out of 5 stars"
"AMADA HOMEFURNISHING Floating Shelves Wall Mounted, Wall Shelf for Bedroom/Bathroom/Living Room/Kitchen, White Shelves 3 Sizes, U-Shaped - AMFS13-W","https://m.media-amazon.com/images/I/71djx+mQWUL._AC_UL320_.jpg","https://amazon.com/Amada-Mounted-U-Shaped-Floating-Shelves/dp/B088ZH365Q/ref=sr_1_28?crid=36QNR0DBY6M7J&keywords=shelves&qid=1675279590&refresh=1&sprefix=s%2Caps%2C309&sr=8-28","$15.99$29.99","5,994","4.5 out of 5 stars"
"Furinno Luder Bookcase / Book / Storage , 5-Cube, White","https://m.media-amazon.com/images/I/61oD6Jvp8TL._AC_UL320_.jpg","https://amazon.com/Furinno-5-Cube-Shelf-White-11069WH/dp/B074NH61RT/ref=sr_1_29?crid=36QNR0DBY6M7J&keywords=shelves&qid=1675279590&refresh=1&sprefix=s%2Caps%2C309&sr=8-29","$30.47","68,142","4.2 out of 5 stars"
"YGEOMER Floating Shelves, Set of 8, Rustic Wall Shelves, Wood Floating Shelf for Bedroom, Living Room, Book and Bathroom（Carbonized Black）","https://m.media-amazon.com/images/I/81PlUYbdliL._AC_UL320_.jpg","https://amazon.com/YGEOMER-Floating-Shelves-Bedroom-Bathroom%EF%BC%88Carbonized/dp/B09X1C8171/ref=sr_1_30?crid=36QNR0DBY6M7J&keywords=shelves&qid=1675279590&refresh=1&sprefix=s%2Caps%2C309&sr=8-30","$33.99$39.99","235","4.6 out of 5 stars"
"Greenco 5 Tier Wall Mount Corner Shelves Rustic White Finish, 7.75" L x 7.75" W x 48.5" H.","https://m.media-amazon.com/images/I/61mp9OM983L._AC_UL320_.jpg","https://amazon.com/Greenco-Corner-Shelves-Rustic-Finish/dp/B08SZC4K3F/ref=sr_1_31?crid=36QNR0DBY6M7J&keywords=shelves&qid=1675279590&refresh=1&sprefix=s%2Caps%2C309&sr=8-31","$24.64","57,319","4.5 out of 5 stars"
"Furinno Turn-N-Tube 5 Tier Corner Display Rack Multipurpose Shelving Unit, 1-Pack, Espresso/Black","https://m.media-amazon.com/images/I/61t6G1jMD+L._AC_UL320_.jpg","https://amazon.com/Furinno-99811EX-BK-Turn-N-Tube-Espresso/dp/B003VP5TPW/ref=sr_1_32?crid=36QNR0DBY6M7J&keywords=shelves&qid=1675279590&refresh=1&sprefix=s%2Caps%2C309&sr=8-32","$25.99","59,321","4.5 out of 5 stars"
"Fixwal Floating Shelves, Deep 4.7in Wall Shelves Set of 5, Rustic Wood Wall Storage Shelves for Bedroom, Living Room, Kitchen, Bathroom, Office and Plants (Black)","https://m.media-amazon.com/images/I/61wLAlY1LKL._AC_UL320_.jpg","https://amazon.com/Fixwal-Floating-Shelves-Storage-Bathroom/dp/B0BM9HR4YG/ref=sr_1_33?crid=36QNR0DBY6M7J&keywords=shelves&qid=1675279590&refresh=1&sprefix=s%2Caps%2C309&sr=8-33","$22.99"
"ISYOKE White Floating Shelves for Wall Mounted Storge Shelf Set of 3 Wall Shelf Decorative Display White Rack Shelves for Bathroom Bedroom Living Room Kitchen Office","https://m.media-amazon.com/images/I/71ETxDzIhmL._AC_UL320_.jpg","https://amazon.com/ISYOKE-Floating-Shelves-Decorative-Bathroom/dp/B0BDZZQDQ1/ref=sr_1_34?crid=36QNR0DBY6M7J&keywords=shelves&qid=1675279590&refresh=1&sprefix=s%2Caps%2C309&sr=8-34","$21.99$24.89","19","4.1 out of 5 stars"
"EACHPAI Corner Floating Shelves Wall Mounted Set of 4, Rustic Wood Wall Storage Shelves for Bedroom, Living Room, Bathroom, Kitchen, Office and More…","https://m.media-amazon.com/images/I/71EeBo5+2MS._AC_UL320_.jpg","https://amazon.com/EACHPAI-Floating-Shelves-Mounted-Bathroom/dp/B093GKYPSX/ref=sr_1_35?crid=36QNR0DBY6M7J&keywords=shelves&qid=1675279590&refresh=1&sprefix=s%2Caps%2C309&sr=8-35","$37.99$59.99","4,372","4.4 out of 5 stars"
"4-Tier Shelf Adjustable, Heavy Duty Storage Shelving Unit (250 Lbs Loading Capacity Per Shelf) Metal Shelves Steel Organizer Wire Rack Shelf for Pantry Garage Kitchen","https://m.media-amazon.com/images/I/51wlC7Q-NUL._AC_UL320_.jpg","https://amazon.com/Adjustable-Storage-Shelving-Capacity-Organizer/dp/B0B9NS5B3C/ref=sr_1_36?crid=36QNR0DBY6M7J&keywords=shelves&qid=1675279590&refresh=1&sprefix=s%2Caps%2C309&sr=8-36","$32.99","125","4.7 out of 5 stars"
"Hexagon Floating Shelves,Wall Mounted Wood Farmhouse Storage Honeycomb Wall Shelf Set of 5,for Bathroom, Kitchen, Bedroom, Living Room,Office,Home Room Wall Decor Driftwood Finish (Carbonized Black)","https://m.media-amazon.com/images/I/61n7LvzxJUL._AC_UL320_.jpg","https://amazon.com/Floating-Farmhouse-Honeycomb-Driftwood-Carbonized/dp/B09MLQKG57/ref=sr_1_37?crid=36QNR0DBY6M7J&keywords=shelves&qid=1675279590&refresh=1&sprefix=s%2Caps%2C309&sr=8-37","$37.99$59.99","673","4.8 out of 5 stars"
"You Have Space Flota 17"x 4.5" Book Shelves, Floating Shelves for Living Room Decor, Bathroom Storage, Kitchen, Kids Room Natural Burned Set of 6","https://m.media-amazon.com/images/I/51vUSKllL3L._AC_UL320_.jpg","https://amazon.com/YouHaveSpace-Shelves-Floating-Bathroom-Storage/dp/B09C12C3R2/ref=sr_1_38?crid=36QNR0DBY6M7J&keywords=shelves&qid=1675279590&refresh=1&sprefix=s%2Caps%2C309&sr=8-38","$27.99","720","4.4 out of 5 stars"
"Original Black & Yellow 4-Tier Storage Shelving Unit, Indoor/Outdoor, Heavy Duty Storage Shelving Unit (55”H x 48”W x 20”D)","https://m.media-amazon.com/images/I/71WR0uza4GL._AC_UL320_.jpg","https://amazon.com/Original-Yellow-Storage-Shelving-Outdoor/dp/B0895Z7BZY/ref=sr_1_39?crid=36QNR0DBY6M7J&keywords=shelves&qid=1675279590&refresh=1&sprefix=s%2Caps%2C309&sr=8-39","$104.99$129.99","6,202","4.4 out of 5 stars"
"NEATERIZE Floating Shelves Set of 3 | Durable Wall Shelves with Invisible Bracket | Great Shelf for Bathroom, Bedrooms, Kitchen, Office and Living Room Décor. (White - Small)","https://m.media-amazon.com/images/I/61rEkuDYRsL._AC_UL320_.jpg","https://amazon.com/NEATERIZE-Floating-Invisible-Bathroom-Bedrooms/dp/B0B7ZNRFCR/ref=sr_1_40?crid=36QNR0DBY6M7J&keywords=shelves&qid=1675279590&refresh=1&sprefix=s%2Caps%2C309&sr=8-40","$27.96","357","4.7 out of 5 stars"
"AMADA HOMEFURNISHING Floating Shelves, White Wall Shelves for Bedroom, Living Room, Bathroom, Kitchen, Shelves for Wall Decor Set of 3 - AMFS12","https://m.media-amazon.com/images/I/61EmqiQm8AL._AC_UL320_.jpg","https://amazon.com/White-Floating-Shelves-Triangle-HOMEFURNISHING/dp/B08BCKMBLG/ref=sr_1_41?crid=36QNR0DBY6M7J&keywords=shelves&qid=1675279590&refresh=1&sprefix=s%2Caps%2C309&sr=8-41","$20.39$25.99","5,511","4.5 out of 5 stars"
"Love-KANKEI Floating Shelves Wall Mount Rustic Wood Wall Shelves with Large Storage L16.5 x W12 inch for Kitchen Living Room Bathroom Bedroom Set of 2 Carbonized Black","https://m.media-amazon.com/images/I/71yN1CrNPAS._AC_UL320_.jpg","https://amazon.com/Love-KANKEI-Floating-Shelves-Wall-Mount/dp/B07D724484/ref=sr_1_42?crid=36QNR0DBY6M7J&keywords=shelves&qid=1675279590&refresh=1&sprefix=s%2Caps%2C309&sr=8-42","$38.99$49.99","3,637","4.4 out of 5 stars"
"HOMIDEC Cube Storage Organizer 16-Cube Storage Shelf, Closet Organizer for Garment Racks, Closet Organizers and Storage with Metal Hammer, Bookshelf for Kids, (48.4 L x 12.2 W x 48.4 H Inches),Black","https://m.media-amazon.com/images/I/81rnobIhYDL._AC_UL320_.jpg","https://amazon.com/Bookcase-Bookshelf-Organizer-Bathroom-11-8x11-8x11-8/dp/B08HK82CNT/ref=sr_1_43?crid=36QNR0DBY6M7J&keywords=shelves&qid=1675279590&refresh=1&sprefix=s%2Caps%2C309&sr=8-43","$54.99$59.99","1,745","4.4 out of 5 stars"
"HOMIDEC Closet Organizer, 9-Cube Closet Organizers and Storage, Portable Closet Storage Shelves,Closet Organizer Storage Shelves, Clothes Storage Organizer for Garment Racks, Closet, Wardrobe","https://m.media-amazon.com/images/I/81PK6W+KspL._AC_UL320_.jpg","https://amazon.com/Storage-Organizer-Organizers-Portable-Wardrobe/dp/B08HHKJLK8/ref=sr_1_44?crid=36QNR0DBY6M7J&keywords=shelves&qid=1675279590&refresh=1&sprefix=s%2Caps%2C309&sr=8-44","$33.99$44.99","1,427","4.4 out of 5 stars"
"Herncptar Wall Shelves, Rustic Wood Floating Shelves Set of 4, Hanging Storage Shelf with Invisiable Metal Brackets for Bathroom, Living Room, Kitchen, Bedroom","https://m.media-amazon.com/images/I/71rBtFWgGSL._AC_UL320_.jpg","https://amazon.com/Herncptar-Floating-Invisiable-Brackets-Bathroom/dp/B09QKFLQPS/ref=sr_1_45?crid=36QNR0DBY6M7J&keywords=shelves&qid=1675279590&refresh=1&sprefix=s%2Caps%2C309&sr=8-45","$35.99$38.99","713","4.4 out of 5 stars"
"Bolidery 4 Pack Small Acrylic Floating Shelves, Acrylic Wall Shelves Display Ledges for Storage & Decoration, Mini Shelves for Wall with 2 Types of Installation (Adhesive or Screw)","https://m.media-amazon.com/images/I/61fiGg-sUhL._AC_UL320_.jpg","https://amazon.com/Bolidery-Floating-Decoration-Installation-Adhesive/dp/B0B64Y7JPP/ref=sr_1_46?crid=36QNR0DBY6M7J&keywords=shelves&qid=1675279590&refresh=1&sprefix=s%2Caps%2C309&sr=8-46","$9.99","41","4.3 out of 5 stars"
"Giftgarden 16 Inch Floating Shelves ,Set of 3, Rustic Wall Mounted Picture Ledge Wooden Wall Shelf for Living Room Bedroom Kitchen Bathroom, 3 Different Sizes","https://m.media-amazon.com/images/I/61nj-aGRGoS._AC_UL320_.jpg","https://amazon.com/Giftgarden-Floating-Shelves-Mounted-Bathroom/dp/B087RFGGZS/ref=sr_1_47?crid=36QNR0DBY6M7J&keywords=shelves&qid=1675279590&refresh=1&sprefix=s%2Caps%2C309&sr=8-47","$23.80","8,095","4.6 out of 5 stars"
"SRIWATANA Floating Shelves Wall Mounted Set of 2 Rustic Wood Shelves with Large Capacity(Carbonized Black)","https://m.media-amazon.com/images/I/71kMn60BebL._AC_UL320_.jpg","https://amazon.com/RooLee-Floating-Shelves-Mounted-Capacity/dp/B07GP1GP2M/ref=sr_1_48?crid=36QNR0DBY6M7J&keywords=shelves&qid=1675279590&refresh=1&sprefix=s%2Caps%2C309&sr=8-48","$43.99$51.99","1,882","4.3 out of 5 stars"